{"canonicalization":"wordpress-hx.canonical-json.v1","components":[{"id":"compiler.genes","identity":"git:https://github.com/fullofcaffeine/genes-ts@122162abefc2035b307508e521348ea4fb36dab7#tree=739500b4f4f2513adc3d993cdab6e0e7620965a3","lockEntrySha256":"952dee138a021a2327c56c3b2bd6826b59405cf4267c6f2150096f11255aca46","role":"compiler","source":"git-source","version":"1.38.0"},{"id":"compiler.haxe","identity":"git:https://github.com/HaxeFoundation/haxe@e0b355c6be312c1b17382603f018cf52522ec651#tree=55d2c4c59ed55c52fa0660e2fe385081a94b23d1","lockEntrySha256":"1ed760bf676bedec6c5158629cb161836bb3494d05b775ae306871a7ae8fd99e","role":"compiler","source":"git-source","version":"4.3.7"},{"id":"compiler.reflaxe-php","identity":"sdk:wordpress-hx@0.0.0/compiler/reflaxe.php#sha256=cf0fc152f4fe09b8a9eb92f6b9f4c1f1591ab938531d6241c245ab11a75532f6","lockEntrySha256":"2f8a00a5c6ae96c79b123aa3f62ef5473618781cb64e890f46141735a0c2a6ce","role":"compiler","source":"co-located","version":"0.0.0"},{"id":"runtime.node","identity":"docker.io/library/node@sha256:b04ce4ae4e95b522112c2e5c52f781471a5cbc3b594527bcddedee9bc48c03a0","lockEntrySha256":"7f6c0b82e1346b0d9144d4059bb98ae53fbbfc55abf1f5b5660bcec732386e3c","role":"runtime","source":"oci-image","version":"22.17.0"},{"id":"sdk.wordpress-hx","identity":"repository:wordpresshx@fixture#toolchain-lock-sha256=f76230a6e27154d9ffc467362a0a75c51b633a6aa59bf696df6ab5f15e872785","lockEntrySha256":"e1282e744617c516716bb7161b63e71b36a28734157276dc6074cc87867820a8","role":"sdk","source":"co-located","version":"0.0.0"},{"id":"tool.lix","identity":"npm:lix@15.12.4#sha256=4f2257276aba9f552b1b35237d33fbc1a0898039d8105ed6e8d1468e6c53a2fa","lockEntrySha256":"5794a3ba0fc4e14c0b6a21c1d05d92445dd50db1666bde3594b739322c20834e","role":"dependency-manager","source":"npm-release","version":"15.12.4"},{"id":"tool.npm","identity":"docker.io/library/node@sha256:b04ce4ae4e95b522112c2e5c52f781471a5cbc3b594527bcddedee9bc48c03a0#npm=10.9.2","lockEntrySha256":"0f5d1e5711092eb6919e32a4bc71ff2f1ee4dcba6ee81547dc0c6c9fb4daeea3","role":"package-manager","source":"oci-image","version":"10.9.2"},{"id":"tool.wordpress-scripts","identity":"npm:@wordpress/scripts@31.5.0#integrity=sha512-7OS5bpHtnuagG8k9q9BdilHjhQ0MLhY0ypDgnRom5WlgPBshM/SUaF9bQLDnSDeasiD/bIgaDmoxWkfVZ4qSPQ==","lockEntrySha256":"494bb8c59c6964b30b244f6640bdcd5ac8cdf9060130af811604de9c3561c958","role":"build-tool","source":"npm-release","version":"31.5.0"}],"generatedBy":{"cliVersion":"0.0.0","sdkVersion":"0.0.0"},"lockDigest":"4cfa2c74754de88a9e775a90c5103d14bcaa172eccdb90f639d790b6cab54e22","lockDigestAlgorithm":"sha256-canonical-json-without-lockDigest-v1","packageGraph":{"lifecycleScriptsAllowed":false,"lockfile":{"path":"npm-lock.json","sha256":"596a46a07a4ff7daea8a774c72429d34f7e9397584659b28a7d48c96ad63eac0"},"manager":"npm","manifest":{"path":"npm-manifest.json","sha256":"703ae6f08f6a758c01d946ea30b033a7e3e973a93754f82a03a1fb39b9e272b6"},"version":"10.9.2"},"profile":{"catalogRevision":"wp70-release/catalog-v1","catalogSha256":"530a1581d07e7509fb68f7da5b53575009ed4a94280513efd82a8c99622d9d61","id":"wp70-release"},"project":{"configPath":"wordpress-hx.json","configSemanticSha256":"df18cceedf89682510cd191c6d8551e9b0401c30fc16c81852051ce11b7e8c6c","id":"acme-observatory"},"schema":"wordpress-hx.project-lock.v1"}
